{"$schema":"/ai/search-index.schema.json","schemaVersion":1,"revision":"889bd95389ba3ef6b52259046d37f9adde281ee0a933fe315eea5394f250a074","total":38,"links":{"catalog":"/ai/catalog.json","guide":"/ai/README.md","skill":"/ai/SKILL.md"},"facets":{"categories":{"background":4,"cards":4,"collaboration":2,"cursor":3,"data":1,"feedback":2,"files":1,"hero":4,"input":4,"layout":4,"media":1,"navigation":4,"scroll":1,"text":3},"frameworks":{"preact":38,"react":38,"solid":38,"svelte":38,"vanilla":38,"vue":38},"visualTags":{"3d":4,"ascii":4,"blue":1,"botanical":1,"capsule":2,"cards":3,"chart":1,"colorful":1,"compact":2,"cosmic":3,"cyber":1,"dots":3,"editor":1,"editorial":1,"elastic":3,"glass":6,"gradient":1,"grain":1,"ice":1,"illustration":1,"line-art":1,"liquid":2,"minimal":8,"monochrome":2,"nautical":1,"paper":1,"particles":4,"photography":2,"print":1,"product":2,"refraction":1,"spider":1,"spring":2,"stickers":1,"tactile":2,"translucent":1,"typographic":1}},"items":[{"slug":"ascii-object","name":{"en":"ASCII Object","zh":"ASCII 物体"},"summary":"让任意 GLB/glTF 模型、SVG 或图片悬浮在影棚场景中，并以贴合轮廓的 ASCII 字符重绘。","frameworks":["react","vue","svelte","solid","preact","vanilla"],"renderers":["webgl","webgpu"],"docsPath":"/docs/components/ascii-object","detailPath":"/ai/components/ascii-object.json","previewPath":"/assets/videos/ascii-object-leibox.webm","sourceProvider":"upstream","discovery":{"category":"hero","useCases":["品牌模型展示","首屏视觉","3D model showcase"],"searchTerms":["字符","ascii","模型","3d","logo","首屏","hero"],"visualTags":["ascii","3d"],"interactions":["pointer"],"caveat":"需准备目标模型、SVG 或图片；渲染器要求见详情。"}},{"slug":"asciify","name":{"en":"Asciify","zh":"字符透镜"},"summary":"柔和的透镜跟随光标，将下方的实时 HTML 重绘为 ASCII 字符。","frameworks":["react","vue","svelte","solid","preact","vanilla"],"renderers":["webgl","webgpu"],"docsPath":"/docs/components/asciify","detailPath":"/ai/components/asciify.json","previewPath":"/assets/videos/asciify.webm","sourceProvider":"upstream","discovery":{"category":"cursor","useCases":["鼠标探索效果","网页局部字符化","cursor lens"],"searchTerms":["字符","ascii","透镜","鼠标","光标","cursor","lens"],"visualTags":["ascii"],"interactions":["pointer"],"caveat":"涉及实时 HTML 捕获，先查看详情中的浏览器要求与回退说明。"}},{"slug":"frost","name":{"en":"Frost","zh":"冰霜"},"summary":"在实时 HTML 上覆盖冰层，光标划过时融化，离开后重新结冰。","frameworks":["react","vue","svelte","solid","preact","vanilla"],"renderers":["webgl","webgpu"],"docsPath":"/docs/components/frost","detailPath":"/ai/components/frost.json","previewPath":"/assets/videos/frost.webm","sourceProvider":"upstream","discovery":{"category":"cursor","useCases":["冰霜擦除互动","节日活动首屏","ice reveal"],"searchTerms":["冰霜","冰冻","融化","擦除","ice","frost","reveal"],"visualTags":["ice","translucent"],"interactions":["pointer"],"caveat":"涉及实时 HTML 捕获，先查看详情中的浏览器要求与回退说明。"}},{"slug":"glass","name":{"en":"Glass","zh":"玻璃透镜"},"summary":"玻璃透镜跟随光标，折射实时 HTML，并像水晶球一样放大目标。","frameworks":["react","vue","svelte","solid","preact","vanilla"],"renderers":["webgl","webgpu"],"docsPath":"/docs/components/glass","detailPath":"/ai/components/glass.json","previewPath":"/assets/videos/glass.webm","sourceProvider":"upstream","discovery":{"category":"cursor","useCases":["鼠标放大镜","首屏玻璃透镜","magnifying cursor"],"searchTerms":["玻璃","透镜","放大镜","折射","鼠标","glass","lens","magnifier"],"visualTags":["glass","refraction"],"interactions":["pointer"],"caveat":"涉及实时 HTML 捕获；玻璃文件管理卡片应选择 glass-folder。"}},{"slug":"glass-object","name":{"en":"Glass Object","zh":"玻璃物体"},"summary":"将任意 3D 模型、SVG 或图片变为悬浮液态玻璃，呈现真实折射、色散与磨砂效果。","frameworks":["react","vue","svelte","solid","preact","vanilla"],"renderers":["webgl","webgpu"],"docsPath":"/docs/components/glass-object","detailPath":"/ai/components/glass-object.json","previewPath":"/assets/videos/glass-object-leibox.webm","sourceProvider":"upstream","discovery":{"category":"hero","useCases":["玻璃品牌标志","产品模型展示","glass logo showcase"],"searchTerms":["玻璃","液态","折射","模型","logo","glass","3d","hero"],"visualTags":["glass","3d"],"interactions":["pointer"],"caveat":"需准备目标模型、SVG 或图片；渲染器要求见详情。"}},{"slug":"glyph-rain","name":{"en":"Glyph Rain","zh":"字符雨"},"summary":"下落的字符流照亮实时 HTML，光标穿过时，字符雨的前端会涌动增强。","frameworks":["react","vue","svelte","solid","preact","vanilla"],"renderers":["webgl","webgpu"],"docsPath":"/docs/components/glyph-rain","detailPath":"/ai/components/glyph-rain.json","previewPath":"/assets/videos/glyph-rain.webm","sourceProvider":"upstream","discovery":{"category":"background","useCases":["代码雨背景","科技主题首屏","matrix code rain"],"searchTerms":["代码雨","字符雨","黑客","矩阵","matrix","rain","background"],"visualTags":["ascii","cyber"],"interactions":["pointer","autoplay"],"caveat":"涉及实时 HTML 捕获；保持正文可读，浏览器要求见详情。"}},{"slug":"particle-object","name":{"en":"Particle Object","zh":"粒子物体"},"summary":"将任意 3D 模型、SVG 或图片重建为粒子，在光标周围散开后弹回原来的形状。","frameworks":["react","vue","svelte","solid","preact","vanilla"],"renderers":["webgl","webgpu"],"docsPath":"/docs/components/particle-object","detailPath":"/ai/components/particle-object.json","previewPath":"/assets/videos/particle-object-leibox-3d.webm","sourceProvider":"upstream","discovery":{"category":"hero","useCases":["粒子 Logo","交互模型展示","interactive particle logo"],"searchTerms":["粒子","散开","聚合","模型","logo","particles","3d","hero"],"visualTags":["particles","3d"],"interactions":["pointer"],"caveat":"需准备目标模型、SVG 或图片；渲染器要求见详情。"}},{"slug":"particle-scroll","name":{"en":"Particle Scroll","zh":"粒子滚动"},"summary":"将指定分界线下方的实时 HTML 化为细沙粒子，并随滚动重新聚合。","frameworks":["react","vue","svelte","solid","preact","vanilla"],"renderers":["webgl","webgpu"],"docsPath":"/docs/components/particle-scroll","detailPath":"/ai/components/particle-scroll.json","previewPath":"/assets/videos/particle-scroll.webm","sourceProvider":"upstream","discovery":{"category":"scroll","useCases":["滚动叙事","页面消散过渡","scroll storytelling"],"searchTerms":["滚动","消散","细沙","粒子","scroll","dissolve","particles"],"visualTags":["particles"],"interactions":["scroll"],"caveat":"涉及实时 HTML 捕获；适合局部叙事段落，浏览器要求见详情。"}},{"slug":"liquid-object","name":{"en":"Liquid Object","zh":"流体物体"},"summary":"让任意 3D 模型、SVG 或图片穿过隐形液体，在光标下旋转流动，并将光线分解为色彩。","frameworks":["react","vue","svelte","solid","preact","vanilla"],"renderers":["webgl","webgpu"],"docsPath":"/docs/components/liquid-object","detailPath":"/ai/components/liquid-object.json","previewPath":"/assets/videos/liquid-object-leibox.webm","sourceProvider":"upstream","discovery":{"category":"hero","useCases":["液态品牌展示","流体模型互动","liquid model showcase"],"searchTerms":["液态","流体","模型","logo","liquid","fluid","3d","hero"],"visualTags":["liquid","3d"],"interactions":["pointer"],"caveat":"需准备目标模型、SVG 或图片；渲染器要求见详情。"}},{"slug":"spider-music-player","name":{"en":"Spider Track Switcher","zh":"蜘蛛牵引切歌"},"summary":"八足蜘蛛结网牵引专辑封面，在队列与播放区之间连续搬运，搭配真实专辑图片和可操作的本地播放控件。","frameworks":["react","vue","svelte","solid","preact","vanilla"],"renderers":[],"docsPath":"/docs/animations/spider-music-player","detailPath":"/ai/components/spider-music-player.json","previewPath":"/assets/components/spider-music-player.png","sourceProvider":"leibox","discovery":{"category":"media","useCases":["专辑封面连续切换","趣味音乐播放器","animated album queue"],"searchTerms":["蜘蛛","蛛丝","结网","音乐","专辑","封面","切歌","队列","spider","music","album","player","queue"],"visualTags":["photography","tactile","spider"],"interactions":["click","keyboard","input"],"caveat":"使用真实封面与本地播放计时；接入真实音源时替换媒体数据并核对封面权限。"}},{"slug":"collection-layout-morph","name":{"en":"Collection Layout Morph","zh":"列表卡片堆叠切换"},"summary":"Claude、Codex、Grok 三张 SVG 在列表、并排卡片与叠放之间连续移动、缩放和重排。","frameworks":["react","vue","svelte","solid","preact","vanilla"],"renderers":[],"docsPath":"/docs/animations/collection-layout-morph","detailPath":"/ai/components/collection-layout-morph.json","previewPath":"/assets/components/collection-layout-morph.png","sourceProvider":"leibox","discovery":{"category":"layout","useCases":["收藏列表切换","卡片布局变换","list grid layout switch"],"searchTerms":["列表","卡片","堆叠","布局","切换","list","grid","layout","stack"],"visualTags":["cards"],"interactions":["click","keyboard"],"caveat":"接入时替换演示图片和条目，保留共享元素的连续布局。"}},{"slug":"brand-poster-cards","name":{"en":"Brand Poster Cards","zh":"品牌海报三联卡片"},"summary":"三张人像海报统一搭配左上角标、中央品牌字标与底部介绍，图片轻缓缩放，标志和文字保持固定。","frameworks":["react","vue","svelte","solid","preact","vanilla"],"renderers":[],"docsPath":"/docs/animations/brand-poster-cards","detailPath":"/ai/components/brand-poster-cards.json","previewPath":"/assets/components/brand-poster-cards.png","sourceProvider":"leibox","discovery":{"category":"cards","useCases":["品牌海报展示","人物作品集","brand poster portfolio"],"searchTerms":["品牌","海报","人物","作品集","brand","poster","portrait","portfolio"],"visualTags":["photography","editorial"],"interactions":["hover","click","keyboard"],"caveat":"替换演示人像、品牌标志和文案，并确认素材使用权限。"}},{"slug":"dot-matrix-trio","name":{"en":"Dot Matrix Ripple and Spiral","zh":"点阵波纹与旋涡"},"summary":"三张点阵卡片同步呈现双色扩散波纹、旋转旋涡与圆形扩张，保留印刷排版和渐变背景。","frameworks":["react","vue","svelte","solid","preact","vanilla"],"renderers":[],"docsPath":"/docs/animations/dot-matrix-trio","detailPath":"/ai/components/dot-matrix-trio.json","previewPath":"/assets/components/dot-matrix-trio.png","sourceProvider":"leibox","discovery":{"category":"background","useCases":["品牌点阵展示","印刷风动效卡片","dot matrix brand cards"],"searchTerms":["点阵","波纹","旋涡","品牌","dot","matrix","ripple","spiral"],"visualTags":["dots","print"],"interactions":["autoplay","click","keyboard"],"caveat":"三联卡片视觉；等待反馈可优先比较 ai-generating。"}},{"slug":"selection-flower","name":{"en":"Text Selection Flowers","zh":"文字选区开花"},"summary":"拖选真实文字，每个字符周围长出随机配色的描边花朵；松手后花瓣、叶片和茎依次反向收回。","frameworks":["react","vue","svelte","solid","preact","vanilla"],"renderers":[],"docsPath":"/docs/animations/selection-flower","detailPath":"/ai/components/selection-flower.json","previewPath":"/assets/components/selection-flower.png","sourceProvider":"leibox","discovery":{"category":"text","useCases":["文章趣味选区","编辑型作品集","playful text selection"],"searchTerms":["文字","选区","开花","花朵","文章","text","selection","flowers"],"visualTags":["botanical","illustration"],"interactions":["text-